Unnamed: 0,Text_Data,Category
39.0,"CITY OF REDMOND, UTILITY BILLING. © ‘hone 425-556-2152 STATEMENT DATE ACCOUNT NUMBER 15670 NE 85' STREET, 3NFN Fax 425-556-2909 42/1/2021 035756-000 REDMOND, WA 98052 utilitybilling@redmond.gov Redmond Office Hours: Mon-Fri, 8am-5pm SERVICE ADDRESS or PARCEL NUMBER 9423900000 _ DAA BILL DATE 12/11/2021 11/02/2021 — TET Ta DID YOU FORGET? * RETAIN THIS UPPER PORTION FOR YOUR RECORDS + Our records show that your utility account with the City of Redmond is past due in the amount indicated above. For your convenience, we have listed our payment options below. Payment must be made payable to the City of Redmond with adequate time allowed for delivery by the due date. Please disregard this notice if payment has been made. Thank you. Payment Options Direct Debit: | Request a Direct Debit application from Utility Billing which will provide you with the convenience of paying your future utility bills automatically from your bank account on the due date reflected on your statement. Visit www.redmond.gov/UBPaymentoptions or call 425-556-2152 to obtain more information. Mail: City of Redmond * Utility Billing * PO Box 3745 * Seattle, WA 98124-3745 In Person: City Hall, 15670 NE 85th St, Redmond, WA 98052 Office hours: 8:00 a.m. - 5:00 p.m., Monday through Friday Drop Box: Located on the traffic island in front of City Hall at 15670 NE 85th St. Please do not deposit cash in the drop box Online: www.redmond.gov/ubonlinepayment Telephone: Visa or MasterCard Payments, call (425) 556-2152. (Press option 1 for the automated service.) (Please note that on-line payments through your bank may take up to 10 days to reach the City.) In the event of a disputed bill, please contact Utility Billing at (425) 556-2152 prior to the above due date. If necessary, a meeting with a manager or another employee empowered to resolve the billing dispute will be arranged at your request. If the billing is deemed to be correct, and you have been notified of that decision, the City of Redmond retains the option of terminating water service or proceeding with other available resolutions. CITY OF REDMOND, UTILITY BILLING SERVICE ADDRESS or PARCEL NUMBER 15670 NE 85TH STREET, 3NFN REDMOND, WA 98052 9423900000 Redmond Phone 425-556-2152, Fax 425-556-2909, utilitybilling@redmond.gov PAYMENT DUE DATE | ACCOUNT NUMBER MAKE CHECKS PAYABLE TO CITY OF REDMOND 2/11 2021 035756-000 Allow adequate time for delivery by due date. AMOUNT | AMOUNT PAID $3,074.86 ENSURE PAYMENT ADDRESS SHOWS THROUGH PAYMENT ENVELOPE 141***G49*0,574""*2/2*eteeeh* SNGLP MEADOWVIEW VILLAGE CITY OF REDMOND C/O PROPVIVO Ey ao 2018 156TH AVE NE BOX 374 BELLEVUE WA 98007-3825 SEATTLE ap 98124-3745 141 2/2 fie",invoices
40.0,"Silver Lake Water & Sewer District “=-3 15205 - 41st Ave. SE Bothell, WA 98012-6114 (425) 337-3647 * www.siwsd.com METER NUMBER 93644110 SERVICE DATES BILLING PREVIOUS PRESENT DAYS 09/01/2021 09/30/2021 29 CONSUMPTION HISTORY IN 100 CUBIC FEET MONTH / YEAR #DAYS WATER USAGE SEP 21 33 27 AUG 21 30 31 JUL 21 32 36 JUN 21 31 18 MAY 21 29 0 APR 21 31 0 MAR 21 29 1 FEB 21 30 0 JAN 21 29 0 DEC 20 33 0 NOV 20 30 0 OCT 20 28 20 SEP 20 34 30 ACCOUNT MESSAGES ACCOUNT NUMBER DUE DATE AMOUNT DUE 39884 - 43653 10/15/2021 $94.25 NAME PARKHAVEN HOA SERVICE ADDRESS NW CRNR 170TH PL SE & 42ND DR SE BOTHELL METER READING PREVIOUS PRESENT USAGE UNer SLL OME 2146 Z1i3 27 1 09/30/2021 Previous Balance Charges: $124.65 Payments/Credits/Payment Reversals: $(124.65) Adjustments: $0.00 Total Previous Balance: $0.00 Current Charges New Account Charges: $0.00 Water Base Rate: $14.60 Water Consumption Charge $79.65 Sewer Base: $0.00 Other Service Charges: $0.00 Other Service Adjustments: $0.00 Total Current Charges: $94.25 Total Amount Due: $94.25 Winter Water Per Unit Rate: $2.95 per 100 CF of water; September 1, 2021 through April 30, 2022. SLWSD Autopay Silver Lake ah & Sewer District “3 15205 - 41st Ave. SE Bothell, WA 98012-6114 Please check box if you have updated your account information on the back page www.slwsd.com 59818080 3/19 - PARKHAVEN HOA C/O PROPVIVO 2018 156TH AVE NE BELLEVUE WA 98007-3825 Page 5 of 7 This stub ensures that your payment is processed accurately. PLEASE RETURN THIS PART WITH YOUR PAYMENT Please see reverse side for important information. DUE DATE ACCOUNT NUMBER 10/15/2021 39884 - 43653 AMOUNT DUE AMOUNT ENCLOSED $94.25 BILLS MAY BE PAID AT DISTRICT OFFICE OR BY CREDIT/DEBIT CARD AT WWW.SLWSD.COM Please Make Checks Payable To = Thank you for being on Auto Pay",invoices
41.0,"CITY OF REDMOND, UTILITY BILLING Phone 425-556-2152 STATEMENT DATE ACCOUNT NUMBER REDMOND, WA 98052 stitybiling@redmond. gov 12/1/2021 | — 018039-000 Redmond Office Hours: Mon-Fri, 8am-5pm SERVICE ADDRESS or PARCEL NUMBER a 16028 NE 94TH WAY __ Ae ea) ae Fay — 11/02/2021 AMOUNT DUE AMOUNT PAID DID YOU FORGET? * RETAIN THIS UPPER PORTION FOR YOUR RECORDS + Our records show that your utility account with the City of Redmond is past due in the amount indicated above. For your convenience, we have listed our payment options below. Payment must be made payable to the City of Redmond with adequate time allowed for delivery by the due date. Please disregard this notice if payment has been made. Thank you. Payment Options Direct Debit: | Request a Direct Debit application from Utility Billing which will provide you with the convenience of paying your future utility bills automatically from your bank account on the due date reflected on your statement. Visit www.redmond.gov/UBPaymentoptions or call 425-556-2152 to obtain more information. Mail: City of Redmond ° Utility Billing * PO Box 3745 « Seattle, WA 98124-3745 In Person: City Hall, 15670 NE 85th St, Redmond, WA 98052 Office hours: 8:00 a.m. - 5:00 p.m., Monday through Friday Drop Box: Located on the traffic island in front of City Hall at 15670 NE 85th St. Please do not deposit cash in the drop box Online: www.redmond.gov/ubonlinepayment Telephone: Visa or MasterCard Payments, call (425) 556-2152. (Press option 1 for the automated service.) (Please note that on-line payments through your bank may take up to 10 days to reach the City.) In the event of a disputed bill, please contact Utility Billing at (425) 556-2152 prior to the above due date. If necessary, a meeting with a manager or another employee empowered to resolve the billing dispute will be arranged at your request. If the billing is deemed to be correct, and you have been notified of that decision, the City of Redmond retains the option of terminating water service or proceeding with other available resolutions. CITY OF REDMOND, UTILITY BILLING Saal seed ean eel ain 15670 NE 85TH STREET, 3NFN REDMOND, WA 98052 16028 NE 94TH WAY Redmond Phone 425-556-2152, Fax 425-556-2909, utilitybilling@redmond.gov SNA LO ON = CLO LUT NTO eT WASHINGTON MAKE CHECKS PAYABLE TO CITY OF REDMOND 12/11/2021 | 018039-000 Allow adequate time for delivery by due date. AMOUNT DUE AMOUNT PAID $10,880.43 ENSURE PAYMENT ADDRESS SHOWS THROUGH PAYMENT ENVELOPE 141***G49**0,574**1/2""********SNGLP MEADOWVIEW VILLAGE CITY OF REDMOND C/O PROPVIVO UTILITY BILLING 2018 156TH AVE NE PO BOX 3745 BELLEVUE WA 98007-3825 SEATTLE WA 98124-3745 141 1/2 fie",invoices
42.0,"Utility Billing LDERWOOD A nt Number: WATER & WASTEWATER Minne "" Account Name: ISTRICT "" Service Address: Amount Due: 00766000-01 Due Date: 12/14/2021 CANYON PARK TOWNHOMES 1526 192ND ST SE REC $208.60 Water For Life, Forever Clean Reliable Water and Wastewater Services For a Healthy Community Amount Due Previous Payments Balance Current Balance Received Forward Charges $208.60 + = + = $208.60 $-208.60 $0.00 $208.60 Due Date 12/14/2021 OL OI F] ) Phone: 1-866-899-1313 For emergency and other important information, follow & like us on: Ll Online: www.awwd.com €} @Alderwoodwater w @Alderwoodwater ap Drop Off: District Office or Drop Box sinensis DAVIN im DX] ‘Mail: Use Coupon Below OLE () Customer Service: 425-787-0220 Email: help@awwd.com District Office: Phone: 425-743-4605 Location: 3626 156th St SW, Lynnwood, WA 98087 DATABAR FORM #7165 - 3/15/21 RETURN THIS COUPON WITH YOUR PAYMENT LDERWOOD Utility Billing ae ACCOUNT NO.: 00766000-01 Mail payments in envelope provided to: TOTAL AMOUNT DUE: $208.60 Alderwood Water & Wastewater District | Pa 3626 156th Street SW, Lynnwood, WA 98087-5021 “ate a DUE DATE: 12/14/2021 | AMOUNT PAID: ALDERWOOD WATER & WASTEWATER DISTRICT 3626 156TH STREET SW ELECTRONIC SERVICE REQUESTED CANYON PARK TOWNHOMES 233 Seq LYNNWOOD WA 98087-5021 C/O SUHRCO an io 2010 156TH AVE NE STE 100 1100 Cee ee ee BELLEVUE WA 98007-3826 OO?bbOO001 telY¥eOel OOOeOdbO OL=mII OE aa RATE | USAGE CHARGES SEWER CHARGES 134.46 WATER BASE CHARGE 74.14 WATER BASE TIER 0.000000 0 0.00 Eg Billing Summary ©) Water Usage History PREVIOUS BALANCE $208.60 PAYMENT 10/13/2021 $-208.60 9 1 BALANCE FORWARD $0.00 0 CURRENT CHARGES $208.60 Nov Jan Mar May Jul Sep Nov Jan Mar May Jul Sep Nov TOTAL more $208.60 19 20 20 20 20 20 20 21 21 21 21 21 21 Average Daily Charge $3.11 0045161803 11/15/2021 mf ¥ : Do you have an address change? Go Green Please contact our customer service department: Sign up for paperless billing at awwd.com: Email help@awwd.com or Login or create an account and Call 425-787-0220 select “Paperless”",invoices
43.0,"NOTICE OF CANCELLATION LAS ee Writing Company: Account Numb ACE PROPERTY AND CASUALTY INSURANCE COMPANY “3860 4120 7091 001C SAGECREST HOMEOWNERS ASSOCIATION Invoice Date 2018 156TH AVE NE NOV 22 2021 C/O PROPVIVO BELLEVUE, WA 98007 Policyholder SAGECREST HOMEOWNERS ASSOCIATI Your CHUBB agent or broker is: Questions? Want to make a payment? _ THE PARTNERS GROUP LTD Access your account by going to https://commercialservice.chubb.com or contact billing services 1.833.550.9660 Monday through Friday 8AM to 8PM EST WE HAVE NOT YET RECEIVED THE MINIMUM PREMIUM PAYMENT FOR THE POLICY SHOWN BELOW AND HOPE THAT IT HAS ALREADY BEEN MAILED. THIS POLICY IS CANCELLED EFFECTIVE DEC 18 2021 BEGINNING AT 12:01AM. THIS IS THE FINAL NOTICE OF CANCELLATION WE WILL SEND PRIOR TO THE EFFECTIVE DATE AND TIME OF CANCELLATION INDICATED IN THIS NOTICE. Policy: BUSINESS OWNERS 000D96608251 Minimum amount due $648.00 Total amount due $648.00 Due date DEC 17 2021 Payment of premium signifies acceptance of all policy terms and conditions. Further, payment of account premium oT Scoop mnie 0 of ees Ss account eullag practice’: to DS BRIRRG IE return REMUS to ECR RAA receivables. Page 1 Please return This Section Along With Your Payment Thank you for insuring through Chubb. Payments must be made payable and submitted directly to Chubb, P.O. BOX 382001, Pittsburgh, PA 15250-8001. For overnight delivery, please remit to Chubb, ATTN: Box 382001, 500 Ross Street 154-0455, Pittsburgh, PA 15262-0001. Please return this section along with your check, made payable to Chubb, in the envelope provided. Please include the policy number on your check. The return address, printed on the back of this section, should show through the window in the enclosed envelope. Payer SAGECREST HOMEOWNERS ASSOCIATION 2018 156TH AVE NE Policy Number 000D96608251 Payment Enclosed _——— | Account Number 3860 1120 7091 001C Minimum Payment Due $648.00 Total Amount Due $648.00 200499660825100159455860 202112272 000000000648006 8",notice
44.0,"ae AHO422P1. 17901 Von Karman Ave., Suite 1200 irvine, CA 92614-5248 00000018 TP080A091021043013 04 COdOODDNN 0000018 001 TAYLOR CONDOMINIUM HOMEOWNERS. ASSOCIATION PROPVIVO, INC. OPERATING 2018 156TH AVE NE BELLEVUE WA 98007-3825 oe ee 4 i ED TEE RERAEN oo ou A ed a ! MINED § 33 aioe ra elt ane September 9, 2021 For further assistance with. ACH return items please contact us at one of the-two options below; HOA Management Companies: (866) 468-1110 Commercial Banking or Consumer Customers: (855) 343-4070 Thank you for choosing Pacific Premier Bank. Your checking account XXXXXX0655 was adjusted for the following.transaction(s} on 9/9/21, These items were returned for the reasons provided below. OrigAccount Co Ent Desc Retuim Reason Routing # XXXXXX6755 TCOOS50200 _Insufficient Funds 691000019 Eff Date Individual Name Individual iD Amount. 9/8/21 TCOOS50200 Megan Adams 377,00 DR Company totals Totai DR 377.00 Total-CR 0.00",notice
45.0,"PAYMENT BILLING NOTICE BILLING ADDRESS INSURED ADDRESS PRODUCER ADDRESS Parkhaven Homeowners Association Parkhaven Homeowners Association Community Association Underwriters Of America C/O Propvivo, Inc. C/O Propvivo, Inc. 40 Lake Bellevue, Suite 100 2018 156th Avenue NE 2018 156th Avenue NE Bellevue, WA 98005 Bellevue, WA 98007 Bellevue, WA 98007 C14 ACCOUNT # POLICY # INSURANCE COMPANY LINE OF BUSINESS INVOICE DATE 35465 CAU504535-5 AAIC Commercial Package 11/30/2021 THE INSURED HAS THE OPTION OF PAYING THE POLICY PREMIUM OF $2,832.00 IN FULL BY 12/15/2021 OR CHOOSING OUR INSTALLMENT PAYMENT PLAN. IF THE INSURED CHOOSES TO BE BILLED IN INSTALLMENTS, A FIRST PAYMENT OF $944.00 IS DUE BY 12/15/2021. THERE WILL BE A SERVICE FEE OF $8.00 CHARGED ON EACH INSTALLMENT. INSTALLMENT SCHEDULE INSTALLMENT INSTALLMENT TOTAL INSTALLMENT DUE DATE AMOUNT CHARGE INSTALLMENT DOWN PAYMENT 12/15/2021 $944.00 $0.00 $944.00 01/28/2022 $236.00 $8.00 $244.00 02/28/2022 $236.00 $8.00 $244.00 03/28/2022 $236.00 $8.00 $244.00 04/28/2022 $236.00 $8.00 $244.00 05/28/2022 $236.00 $8.00 $244.00 06/28/2022 $236.00 $8.00 $244.00 07/28/2022 $236.00 $8.00 $244.00 08/28/2022 $236.00 $8.00 $244.00 SP Sane Sy $2,832.00 $64.00 $2,896.00 NOTE: THIS INSTALLMENT SCHEDULE IS SUBJECT TO CHANGE IN THE EVENT OF AN ENDORSEMENT OR REVISION TO THE POLICY.IF YOU HAVE SPECIFIC BILLING QUESTIONS YOU MAY CONTACT OUR BILLING DEPARTMENT AT (800) 228-1930. WRITE YOUR POLICY NUMBER ON YOUR CHECK AND MAKE PAYABLE TO COMMUNITY ASSOCIATION UNDERWRITERS. AAIC EFFECTIVE EXPIRATION TOTAL ACCOUNT # POLICY # DATE DATE PREMIUM PREMIUM 35465 CAU504535-5 11/28/2021 11/28/2022 $2,832.00 $2,832.00 RN THIS PORTION WITH YOUR PAYMENT IN THE ENVELOPE PROVIDED. AMOUNT ENCLOSED A re TO ENSURE THAT YOUR ACCOUNT IS PROPERLY CREDITED UNDERWRITERS oN PLEASE INCLUDE THE COUPON WITH YOUR PAYMENT. POLICY EFFECTIVE TOTAL DOWN ACCOUNT # NUMBER DATE DUE DATE PREMIUM PAYMENT 35465 CAU504535-5 11/28/2021 12/15/2021 $2,832.00 $944.00 AAIC PLEASE INDICATE ANY CHANGES IN BILLING ADDRESS PAY ELECTRONICALLY AT: Parkhaven Homeowners Association https://cauinsure.epaypolicy.com C/O Propvivo, Inc. 2018 156th Avenue NE MAKE CHECK PAYABLE AND MAIL TO: Bellevue, WA 98007 Community Association Underwriters P.O. Box 1100 Newtown, PA 18940",notice
46.0,"PAYMENT BILLING NOTICE BILLING ADDRESS INSURED ADDRESS PRODUCER ADDRESS Parkhaven Homeowners Association Parkhaven Homeowners Association Community Association Underwriters Of America C/O Propvivo, Inc. C/O Propvivo, Inc. 40 Lake Bellevue, Suite 100 2018 156th Avenue NE 2018 156th Avenue NE Bellevue, WA 98005 Bellevue, WA 98007 Bellevue, WA 98007 C14 ACCOUNT # POLICY # INSURANCE COMPANY LINE OF BUSINESS INVOICE DATE 35465 CAU504535-5 AAIC Commercial Package 11/30/2021 THE INSURED HAS THE OPTION OF PAYING THE POLICY PREMIUM OF $2,832.00 IN FULL BY 12/15/2021 OR CHOOSING OUR INSTALLMENT PAYMENT PLAN. IF THE INSURED CHOOSES TO BE BILLED IN INSTALLMENTS, A FIRST PAYMENT OF $944.00 IS DUE BY 12/15/2021. THERE WILL BE A SERVICE FEE OF $8.00 CHARGED ON EACH INSTALLMENT. INSTALLMENT SCHEDULE INSTALLMENT INSTALLMENT TOTAL INSTALLMENT DUE DATE AMOUNT CHARGE INSTALLMENT DOWN PAYMENT 12/15/2021 $944.00 $0.00 $944.00 01/28/2022 $236.00 $8.00 $244.00 02/28/2022 $236.00 $8.00 $244.00 03/28/2022 $236.00 $8.00 $244.00 04/28/2022 $236.00 $8.00 $244.00 05/28/2022 $236.00 $8.00 $244.00 06/28/2022 $236.00 $8.00 $244.00 07/28/2022 $236.00 $8.00 $244.00 08/28/2022 $236.00 $8.00 $244.00 SP Sane Sy $2,832.00 $64.00 $2,896.00 NOTE: THIS INSTALLMENT SCHEDULE IS SUBJECT TO CHANGE IN THE EVENT OF AN ENDORSEMENT OR REVISION TO THE POLICY.IF YOU HAVE SPECIFIC BILLING QUESTIONS YOU MAY CONTACT OUR BILLING DEPARTMENT AT (800) 228-1930. WRITE YOUR POLICY NUMBER ON YOUR CHECK AND MAKE PAYABLE TO COMMUNITY ASSOCIATION UNDERWRITERS. AAIC EFFECTIVE EXPIRATION TOTAL ACCOUNT # POLICY # DATE DATE PREMIUM PREMIUM 35465 CAU504535-5 11/28/2021 11/28/2022 $2,832.00 $2,832.00 RN THIS PORTION WITH YOUR PAYMENT IN THE ENVELOPE PROVIDED. AMOUNT ENCLOSED A re TO ENSURE THAT YOUR ACCOUNT IS PROPERLY CREDITED UNDERWRITERS oN PLEASE INCLUDE THE COUPON WITH YOUR PAYMENT. POLICY EFFECTIVE TOTAL DOWN ACCOUNT # NUMBER DATE DUE DATE PREMIUM PAYMENT 35465 CAU504535-5 11/28/2021 12/15/2021 $2,832.00 $944.00 AAIC PLEASE INDICATE ANY CHANGES IN BILLING ADDRESS PAY ELECTRONICALLY AT: Parkhaven Homeowners Association https://cauinsure.epaypolicy.com C/O Propvivo, Inc. 2018 156th Avenue NE MAKE CHECK PAYABLE AND MAIL TO: Bellevue, WA 98007 Community Association Underwriters P.O. Box 1100 Newtown, PA 18940",notice
47.0,"6830 NE 185"" St. Kenmore, WA 98028 RETURN SERVICE REQUESTED OT ee a ae N G LP 34 0.3850 SP 0.530 1134 Ny fEpee beg peg dg Uf fg hye ff yetEMMp eng yaa punge Pade E PTET) fp fal] Braeburn HOA c/o Propvivo 2018 156th Ave NE BELLEVUE WA 98007-3825 2021-09-22 Re: 11820 NE 132nd St - Irrigation Meter Kirkland, WA 98034-2925 Dear Braeburn HOA c/o Propvivo, District records indicate that the backflow assembly(s) listed on the reverse side of this notice is/are due on 2021-10-31. Washington State requires backflow assembly(s) be tested annually per Washington Administrative Code (WAC) 246-290-490. If you have any questions or concerns, please contact (425) 654-6321. A list of certified testers is available at www.wacertservices.org. Testers must submit certification test reports electronically by 2021-10-31. Sincerely, Brian Gumke Safety & Water / Wastewater Quality Coordinator Operations Office Hours (M-F 7:30 a.m. to 4:00 p.m.) Phone: (425) 654-6321 www.nud.net Type Mfr Size (Modet SN CestDue [ppc WILKINS 1.5 SO XLT 085054202 1-10-31 | Right side of the main entrance next.to 13224 120th ave NE, front of community area",notice
48.0,"AHO422P1 17901 Von Karman Ave., Suite 1200 September 16, 2021 Irvine, CA 92614-5248 00000003 TP080A091721043007 01 000000000 0000003 C01 TAYLOR CONDOMINIUM HOMEOWNERS For further assistance with ACH return items ASSOCIATION — please contact us at one of the two options below; PROPVIVO, INC. HOA Management.Companies: (866} 468-1110 OPERATING Commercial. Banking or Consumer Custorners: (855) 343-4070 ‘2018 156TH AVE NE 7"" BELLEVUE WA 98007-3825 Thank-you for choosing Pacific Premier Bank. Your checking account XXXXXX0655 was adjusted for the following transaction(s) on 9/16/21. These items were returned forthe reasons provided below, OrigAccount’ CoEntDesc Return Reason Routing# EffDate Individual Name individual ID. Amount -XXXXXX8076 = TCOOSZ0500° No Account/Unable to 122203950. 9/14/21 TcO0S20500 YiHan 317.17 DR . Locate Account XXXXXX8076 TCOOS20500 No Account/Unable to 122203950 89 9/14/21 YiHan 340.60 DR Locate Account Company totals Total DR 657.17 ‘Total CR 0.00 Som empmrmiiie Fee me ee mem ee Em em # fem ne Fame aN ee te tee 8 eects MN cememe eee we, © weed me temmcene eee ope eX otee® . AEE OE eee Ge EAN gee SVs cele he mesmmemes mes wet Magee tems ee bene gege SAMS Hebe ee Seer eee cee eee awe ©",notice
49.0,"NOTICE OF DELAYED FUNDS AVAILABILITY (1 GORRECTED NOTICE PROPVIVO INC AGENT FOR TAYLOR CONDOMINIUM HOMEOWNERS ASSOCIATIO OPERATING ACCOUNT 2018 156TH AVE NE BELLEVUE WA 98007-3825. If you did not receive this notice at the time you.made the deposit, and the check you deposited is paid, we will refund to-you any fees-for overdrafis-or-rétumed-checks.that result-solely from the additional delay that we are imposing. To ‘obtain refund of such fees, or for-questions, please: call us at. 1-866-351-5646. Account Number: 305689809 Business Date of Deposit: 11/22/2021 Amount of Deposit: $171,402.40 Form provided to customer: [_] In Person KX] Mailed 2 Case by Case Hold: The first $225 of alla business day after the day of the deposit: ggregate deposits to the customer will be available on the first irom the deposit described above. These funds.from the above deposit : We are delaying the availability of $ will be available on the. business. day after the day of your deposit. kK) Exception Hold | : We are delaying the availability of $165,877.40 from the deposit described.above. These funds from the above deposit will be available on the 7 business: day after the day of your deposit Refer to the Hold Reason Explanations below for more information. L) New Account Hold: The account listed above is.considered a new. account. Deposits over $5525.00: The deposit listed above invalves item(s) exceeding $5,525.00. L] Repeated Overdrafts: The account listed above has been repeatedly overdrawn in the:last six months. ().Redeposited Items: The check deposited or cashed was previously returned unpaid. | | Ch mergency. An:emergency, such as a failure of computer. or communication equipment, has occurred. L] Reasonable Cause to Doubt Golléctability: | me wo : we CL] We received notice that the check is being returned unpaid. LJ We have.confidentia! information that indicates that the check may not be paid. [} The check is drawn on an account with repeated overdrafts. [_] We are unabie.to verify the endorsement of a joint payee, [| Some information.on the check is not consistent with other information on the check, L] There-are erasures or other apparent-alterations on the check. 7 The routing. number of the paying bank is not.a current routing number. CJ = The check is postdated or-has-a stale date. Information from the paying bank indicates that the check may not be paid. We have. been notified that the check. has been lost or damaged in.collection. . ‘9 REQ82268 NB. Hold Compieted by _REQSOES cP . Form & System Reviewed by 082268 869 Branch #: oT ""BANK USEONLY. ‘Send form (include copy of deposit) via ServiceNow, using keyword ~reqcc~ (include symbols). ” Revised 062920207",notice
50.0,"P.O. Box 1100 Newtown, PA 18940 Billing Department Phone: (800) 228-1930 NOTICE OF RESCISSION A T COMMUNITY ASSOCIATION UNDERWRITERS PRODUCER ADDRESS Community Association Underwriters Of America 40 Lake Bellevue, Suite 100 Bellevue, WA 98005 C14 INSURED ADDRESS Westwood Village Owners Association C/O Propvivo, Inc. 2018 156th Avenue NE Bellevue, WA 98007 BILLING ADDRESS Westwood Village Owners Association C/O Propvivo, Inc. 2018 156th Avenue NE Bellevue, WA 98007 THE CANCELLATION NOTICE PREVIOUSLY MAILED TO YOU FOR NON - PAYMENT WILL BE RESCINDED UPON CLEARANCE OF YOUR CHECK BY THE BANK. YOUR COVERAGE WILL CONTINUE IN EFFECT UNLESS YOUR CHECK IS RETURNED UNPAID, IF FOR ANY REASON THE CHECK DOES NOT CLEAR THE BANK, COVERAGE WILL CEASE AS OF THE CERTIFIED CANCELLATION DATE, AND THIS NOTICE OF RESCISSION WILL BE NULL AND VOID. LINE OF BUSINESS INVOICE DATE Commercial Package 9/21/2021 RECENT POLICY TRANSACTION HISTORY ACCOUNT # POLICY # INSURANCE COMPANY 19423 CAUS00989-5 AAIC PROC EFF DATE DATE 08/13/2021 08/15/2021 08/13/2021 08/28/2021 09/01/2021 09/01/2021 TRANSACTION RENEWAL BILLING DOWN PAYMENT 3 DAY WARNING - NOC AMOUNT $19,854.00 $6,614.00 $0.00 PRIOR BALANCE $0.00 $0.00 $19,854.00 $19,854.00 CURRENT BALANCE $19,854.00 $19,854.00 $19,854.00 $19,854.00 AMOUNT DUE $0.00 $6,614.00 $6,614.00 $6,614.00 CANCELLATION NOTICE $6,614.00 PAYMENT IN FULL ($19,854.00) NOTICE OF RESCISSION $0.00 09/09/2021 09/30/2021 09/21/2021 09/21/2021 09/21/2021 10/15/2021 $19,854.00 $0.00 $0.00 $19,854.00 $0.00 $0.00 POLICY SUMMARY SINCE LAST STATEMENT CREDITS/ DEBITS/ CURRENT DUE INSTALLMENT PAYMENTS PREMIUMS BALANCE DATE DUE $19,854.00 $0.00 $0.00 10/15/2021 $0.00 REMAINING PRIOR INSTALLMENTS BALANCE 0 $19,854.00 IF YOU HAVE SPECIFIC BILLING QUESTIONS YOU MAY CONTACT OUR BILLING DEPARTMENT AT (800) 228-1930. WRITE YOUR POLICY NUMBER ON YOUR CHECK AND MAKE PAYABLE TO: COMMUNITY ASSOCIATION UNDERWRITERS.YOU MAY PAY THE FULL CURRENT BALANCE BY THE DUE DATE TO AVOID FUTURE INSTALLMENT CHARGES. URN THIS PORTION WITH YOUR PAYMENT IN THE ENVELOPE PROVIDED. A ' NOTICE OF RESCISSION AMOUNT ENCLOSED TT COMMUNITY ASSOCIATION TO ENSURE THAT YOUR ACCOUNT IS PROPERLY CREDITED UNDERWR PLEASE INCLUDE THE COUPON WITH YOUR PAYMENT. CURRENT DUE INSTALLMENT BALANCE DATE DUE 10/15/2021 $0.00 ACCOUNT AAIC POL. EFF. REMAINING POLICY NUMBER DATE INSTALLMENTS 8/15/2021 0 $0.00 NUMBER 19423 CAU500989-5 PAY ELECTRONICALLY AT: https://cauinsure.epaypolicy.com PLEASE INDICATE ANY CHANGES IN BILLING ADDRESS MAKE CHECK PAYABLE AND MAIL TO: Community Association Underwriters P.O. Box 1100 Newtown, PA 18940 Westwood Village Owners Association C/O Propvivo, Inc. 2018 156th Avenue NE Bellevue, WA 98007 = a : —- = : = a a aL it * 1 a i: ' ers 4 otis i if "" : ak pil 1 $ _ i * — i qj : a, ae et — ra = = 4 —_ — is ili i a — rie ini a [it a [iar a! ite rd Tht 1 ee i a —— * ; i “=m —_ “ = = = Oa = = = “a a =—- 7 —| a _ a ie =n = eo =e: Don ee Ee ‘ Las in ee i ei - aa : 7 ak = aa = = a a z = _ - rt 7 a 7 a Pr | - 7 a _ — in we = “a = —_a os. &",notice
