Unnamed: 0,Text_Data,Category
82.0,"First American Title Insurance Company 11400 SE 8th Street, Suite 250 Bellevue, WA 98004 Yuecrest Community Association Attn: | 2018 156th Avenue NE Bellevue, WA 98007 First.American Title Insurance Company Me’ | TN Sagres oy 11400 SE 8th Street, Suite 250 mie | First American Bellevue, WA'98004 (425)732-4881. Fax: (866)812-6185 September 09, 2021 Vuecrest Community Association 2018 156th Avenue NE Bellevue, WA 98007 Attn: File-No. 4244-3805202 The following property has been sold.. Please update your records to reflect these’ changes. Thank You. Property Address: 9898 Vineyard Crest, Bellevue, WA 98004 TRANSFER INFORMATION: Seller; Ying Han Maiting Address:. Buyer: Venkata Krishna Kavarthapu and Srividya Bhagavatheeswaran 10485 NE 6th St, #3725 Bellevue, WA.98052 venkat. kavarthapu@gmail.com New Lender: Lender To Be Determined Closing Date: September 08, 2021 Check amount enclosed: $450,00 and $0.00 (The check may not be included if alternative delivery instructions were provided at closing for this item.) Please see check stub for detailed breakdown of fees Should you need further information, please contact this office at the number listed. First American Title Insurance Company Christine Yuan, Escrow. Officer teamyuan@firstam.com Page tof i Instrument Number: 20210908001511 Document:WD Rec: $204.50 Page-1 of 2 Excise Docs; 31441 77 Selling Price: $3,205,000.06 Tax Amount: $81,730.00 Record Date:9/8/2021 3:09 PM -Electronically Recorded King County, WA AFTER-RECORDING MAIL TO: Venkata Krishna Kavarthapu and Srividya Bhagavatheeswaran 10485 NE 6th St, #3725 Bellevue, WA 98052 Fited for Record at Request of: Space above this tine for Recorders Use OW First American Title Insurence Company STATUTORY WARRANTY DEED File. No: 4244-3805262.(CY) Date:. September 02, 2021 Grantor(s); YING HAN, AN-UNMARRIED. PERSON Grantee(s): Venkata Krishna Kavarthapu and Srividya Bhagavatheeswaran, a married couple oo | Abbreviated Legal: LOT 29, BLK 3, VUECREST, VOL. 43, P, 22-23, KING COUNTY Additional Legal on page: Assessor's Tax Parcel No(s): 896480031005 FIRST AMERICAN 350520 2 ‘THE GRANTOR(S) YING HAN, AN UNMARRIED: PERSON for and in consideration of Ten Dollars and other Good and Valuable Consideration, in hand paid, conveys, and warrants tO Venkata Krishna Kavarthapu and Srividya Bhagavatheeswaranh, a married coupte, the following described real estate, situated in the County of King, State of Washington. LEGAL DESCRIPTION: Real property in the County of King, State of Washington, described as follows: LOT 29, BLOCK 3, VUECREST, ACCORDING TO THE PLAT THEREOF RECORDED IN VOLUME 43 OF PLATS, PAGES.22 AND 23, RECORDS OF KING COUNTY, WASHINGTON. SITUATE IN THE COUNTY OF KING, STATE OF WASHINGTON. Subject To: This conveyance is subject to covenants, conditions, restrictions and easements, If any, affecting title, which may appear in the public record, including those shown on-any recorded plat or survey. Page 1 of 2 LPB 10-05 Instrument Number: 20210908001511 Document:WD Ree: 3204.50 Page-2 of 2. Record Date:9/8/2021 3:09 PM King County, WA APN: 896480031005 Statutory Warranty Deed File No.: 4244-3805202 (CY) Yi Hox by Oe Wa OS Attarey fin Fact Ying Han by Lei Hu as Attorney In Fact STATE.OF Washington ) }-ss COUNTY OF King ) On this q Day of September, 2021, before me personally appeared Lei Hu to me-known to be the Individual who executed the foregoing instrument as. Attorney in Fact for Ying Han and acknowledged that he/she signed the same as his/her free and voluntary..act and deed as Attorney. in Fact. for said principal for the uses and purposes therein mentioned, and on oath stated that the Power of Attorney authorizing the-execution of this instrument has ‘not been revoked and that.the’ said principal is now living, and js not-incompetent. GIVEN under my hand and official seal the day and year last above Ne Notary Public in.2 e State of Washington Residing at: For,t 3 My appointment expires. Su, TS LOVZ KEVIN REN Natary Public State of Washington Commission #160076 a My Comm. Expires Aug 28, 2023 ‘Page 2 of 2 LPB 10-05 | RESIDENT INFORMATION SHEET Association Name: UNIT # First Name Middle Name Last Name First Name Middle Name last Name First Name: Middle Name Last Name Address City State Zip Email Home Phone Cell Phone: Work Phone COE TN ge First Name Middle Name. Last Name First Name Middle Name. Last Name First Name Middle Name Last Name. ‘Lease Start Date Lease End Date EMERGENCY CONTACT (Piease Notify} First Name Middle Name Last Name Address City State Zip Email Home Phone Cell Phone Work Phone dH _ eo 71 ‘Make/Model “Year License Plate State. ‘Make/Model Year License Plate State Dogs. Number. Cat Number. Vuecrest Community Association 2018 156th Avenue NE Bellevue, WA 98007 First American First American Title Insurance Company 11400 SE 8th Street, Suite. 250 ‘Bellevue, WA $8004 Phn - (425}455-3400 ‘Fax.--(866)812-6185- Escrow, International.wa@firstam.com September'02, 2021 Fite No.: 4244-3805202 (CY) Atin: Re: | Property Address: 9898 Vineyard Crest, Bellevue, WA 98004 Projected Closing Date: September 08, 2021 ‘Current Owner: Ying Han New Owner: Venkata Krishna Kavarthapu.and Srividya Bhagavatheeswaran Forwarding Address: 10485 NE 6th St, #3725, Bellevue, WA.98052 We are currently handling @ transaction involving the property described above. On the attached page, please complete the information which is applicable to this property; sign the form where indicated and return by fax, to FAX #(866)812-6185 at-your earliest convenience. Also, please include copies of the documents indicated below. [X J] Statement of Account Only [ ] By-Laws [ ] Rules.& Regulations [- ] Articles of Incorporation [ ] Current Budget/Reserve Statement ] Owner Occupancy Ratio ] Fidelity Bond ] Letter regarding pending litigation (if any) ] 12 Months of Minutes ] Other Should you have any questions or need assistance please contact the undersigned. First American Title Insurance Company Julie Chhor, Assistant for Christine Yuan, Escrow Officer Page 1 of 2 please’ Complete arid Return by FAX to: Fax No. (866)812-6185 First American Title Insurance Company: File: No. .4244-3805202 (CY) 11400 SE 8th Street, Suite 250 | Bellevue, WA 98004 Attn: Christine Yuan Current Owner: Ying Han Property Address: 9898 Vineyard Crest, Bellevue, WA 98004 1. Dues Payable [ Monthly [| Quarterly W Annually Dues Amt-$ 305.00. 2, Dues are current Yes L_] no If.NO, Amount-due $.. Covers period from to 3. Date fiext HOA Dues arepayabler 01/01/2022 Covers petiod from 01/01/2022 ty 12/31/2022 4, Hazard.insurance included in assessment fee [| Yes A NO If yes; provide: Name Policy Na.: Prone'No.: . If billed to Homeowner, last amt billed $. Date pald thru 5. Utilities:included in assessment fee. [-j] ves | no If yes, provide: -Name- Phone No.: Tf billed to Homeowner, last.amt billed $ Date pald thru 6, Transfer: fee: Payable to (See attached pages Amount Due $ 37, Statement fee: Payable.to. Amount Due $ 8 ‘Other. fee: Explain: Payable to Amount Due $ 9. Assessment-Payableé (| Monthly [] Quarterly [} Annually Assessment Amt $ 10. Violations or restrictions on Property:. |] yes (4 No Amount Die $ If Yes, explain: 11. Do the Association documents require that. any fee (e:g. transfer fee, move-in/move-out fee) be paid by a particular, party? [.] YES' £ ]NO ‘IF Yes, Explain Total amount due.as of Date of this Statement: $ By: ¥ PropVIVO ine. 4 Date: 99/04/2021 Phone No: _. . Rahul Dubey. — 888-392-3515. (Print Name) . _ Sérvices ropvive.com ‘Emait : ) Z _ (Mailing Address) (Mailing City, State Zip) Page 2: of 2 Vuecrest Community Association ‘treasirer@vuecrest.net P.O. Box 312 Bellevue, WA 98009 Statement of Account Vuecrest Community Association Statement Date | 99/04/2021 Property Address | 9898 Vineyard Crest, Bellevue, WA 98004 order Date | 8/29/2021 Requested By | First American Title and Escrow sep. rez-tete Buyer's Namie Venkata Krishna Kavarthapu and-Srividya Bhagavatheeswaran S66-912.0408 dle Chor This information is being provided by Vuecrést Community. Association as.a‘courtesy service to lenders and other real estate professionals: Although Vuecrest Community Association beliéves that the information provided is complete and accurate, the requesting party \inderstands and acknowledges. that this information is subject to change. without notice and that Vuecrest Community Association is not responsible for any inaccurate or omitted information Vuecrest Community Association treasurer@vuecrest.net P.O. Box 312 Bellevue, WA 98009. Statement of Account ‘Vuecrest Community Association Due Paid 305.00 | | 450,00 Fee Fee | Transfer Fee | 20210901 |$150.00] _ | $300.00 ee [anrme SSO All FEES/AMOUNTS PAYABLE AT CLOSING rf ) Vuecrest Community Association Mail all payments to: C/o PropviVO Ine. 2018-256th AVENE, Bellevue, WA 88007 Make Check Payabie to: Vuecrest Community Association C/o PropVIVO Ine. See page 2 for comments and Fee Details Please provide Vuecrest Homes Association with: - A copy of Assignment of Lease/Deed AND Mortgage; or copy of Agreement of Sale. Description of Fees Paid to Association. Additional Comments Regular Assessmenits.Paid Through 12/31/2021! Any outstanding balances or credits will be | applied to the buyer's.account if not-usSed prior Current Balance 305 to or in closing. Buyer should refer to Association Transfer Fees $300.00 |-http://www.vuecrest net for governing Working Capitat Contribution $0.00 | documents, regulations and guidelines on Reserve Contribution $0.00 remodeli ng-or redeveloping, and other Legal Fees | $0.00 | information about Vuecrest Community Buyer’s Advance Assessments $0.00 | Association, Demand Fee. $150.00 Delivery Date ‘This information is-being provided by Vuecrest Community Association‘as.a caurtesy service to lenders and other real estate professionals. ‘Although Vuecrest Community Association believes that. the information pravided is complete and accurate, the requesting party understands and-acknowledges that this information is subject to change without notice cand that Vuecrest. Commu nity Association is notresponsible for any fiaccurate or omitted information Vuecrest Community Association P.O, Box 312 Bellevue, WA 98009 Statement of Account Vuecrest Community Association, Association Assessments treasurer@vuecrest.net Amount.of Property Assessment is? $305.00 Frequency of Property Assessment? Annual The Late Fee is (enter the actual-amount): 12%. Assesstnents are -due onthe (for instance, “Sth"" /-""L0th""}:. January 1st The Late Fee Interest is (for instance, ""10% per Annum”): 1% monthly on the 16th Assessments are.past.due on {for instance, ""the Sth” /“the 10th""): February 15th Other Assessment amount? $0.00 Amount of any active Special Assessments? $0.00 Is theré:a Community Enhancement Fee? No: If so, how is Fee‘determined / calculated? PERSONAL UNIT/HOME.AREAS INCLUDED IN BASE ASSESSMENT Unit/Home Electricity? No Unit/Home Gas?- No Unit/Home Water? No Unit/Home Sewer? No INSURANCE INFORMATION Insurer's Name? CAU Contact Information?: Amy Clements Phorie Number? 800,228,1930 | hereby certify that the above information is true and.correct to the best of my knowledge and belief. : a 09/04/2021 Signature of person.completing form Statement Date By signing below. i:hereby acknowledge that [ have received and read the information in this certificate for resale. Seller's Signature: Date. Buyer's Signature ‘Seller's Signature Date Buyer's Signature Date’ This information is being provided by Vuecrest Community Association as a courtesy:service to lenders and other real ‘estate professionals. Although Vuecrest Community Association believes that the information provided is complete and accurate, the requesting party understands and acknowledges that this information is subject to change-without noticé ‘and that Vuecrest:Community Association is not responsible for any inaccurate or omitted information First American Title Insurance Company ,Bellevue DATE: 9/9/2021 FILE NO.4244-3805202 SETTLEMENT DATE:9/8/2021 CHECK AMOUNT: $450.00 BUYER: Bhagavatheeswaran SELLER: Han Property Address: 9898 Vineyard Crest, Bellevue, WA 98004 Lot: 29 Homeowner Association Dues Re: 20210901 Charge Details: Transfer Fee: 300.00 Document Fee: 150.00 ORIGINAL DOCUMENT iS PRINTED on CHEMICAL REACTIVE PAPER & HAS A MiCROPRINTED BORDER TO THE Vuecrest Community Association Mb! ge. ORDER 2018 156th Avenue NE OF Bellevue, WA 98007 PR. NWEST First American Trust, FSB - 1177669497 i i Ofc. 4244(11776 5 First American Way [400 SEN cohort Sake 350 — ey Santa Ana CA 92707 90-4125/1222 Bellevue, WA 98004 FILE NO. 4244-3805202 (425)455-3400 Re: 20210901 Date 9/9/2021 PAY Four hundred fifty and 00/100 DOLLARS$******450.00 Escrow Trust Account Void After 180 Days a THE FACE OF THIS DOCUMENT INCLUDES A HIDDEN WORD - DO NOT CASH IF THE WORD VOIDIS VISIBLE a MPT PEBIGGTH tbeeehbcSSts 344877600001""",insurance
83.0,"nover nce -Group* — ‘Insura Customer number: 1515779237-001-000 Bank accourit number: ********4268 Statement date: 41/26/2021 Our valued customer(s): PROPVIVO INC 2018 156TH AVENE ~ BELLEVUE, WA 98007 Contact us. Billing questions: Make a payment: 24 hour claims: For policy and address changes eT ere Agent: 0901603 Agent telephone: i a EL AY PAS 1 800-922-8427 www.Hanover.com/MHP or 1-800-573-1187 1-800-628-0250 THE PARTNERS GROUP, LTD. 41225 SE-6TH ST STE 110 BELLEVUE, WA-98004 425-455-5640 marae : 003853 we PLEASE SEE THE BACK OF THIS NOTIGE.FOR IMPORTANT.POLICY INFORMATION. PROPVIVO INC 2018 156TH AVE NE BELLEVUE, WA 98007 For address changes, please contact your agent. tof 2 47/20/2021 . 4 Rene IMPORTANT INFORMATION — — PLEASE READ “4414/2021 [5103.00 | pr i tr re rei 2 ee ee EI. Ne cee ee RE ee EAI i ee ee PE Ree oe EA Neem Se re er rm re hh ree IMPORTANT INFORMATION ‘ $ : An ‘account is defined as all policies listed in the “Company Information” ‘section of this notice. For changes to your policy including address changes, please contact your agent. Your agent’s name and number are located on the front of this natice. You have authorized the Hanover insurance Company or its applicable underwriting affiiated company (“Company”) to debit your bank account to ‘pay.the premium on your policies as they become due. You have also agreed that ifa debit is. dishoriored by your bank, the. bank-shall have no liability even if the dishanored debit results in the:cancellation of your: ‘insurance. This authorization will remaiz in full force and effect. until the ‘Company and.the bank have each received written notice from you:af the termination of the.authorization and in such time and such manner as to afford the Company and the bank, respectively, a reasonable time to act. on. it: To make changes fo your banking information and/or to stop a scheduled withdrawal, you may log into our website, www.Hanover.com/MHP or provide the Company written notice of the changes. To impact a scheduled withdrawal, requested changes must be.made.no later than 1 day before the scheduled withdrawal. lfan EFT: withdrawal is. dishonored by your bank for insufficient.or- uncollectible.funds, we will terminate your EFT arrangement. Subsequent _Instaiiment bis will be.mailed.to you. All bank returns for insufficient or uncoflectible funds will be subject to a return payment-fee.as provided below. Any credit balance.on a.policy will first be.applied to the:amount due on any other policy/policies within your account in-the order of their due dates and. any remaining credit will be refunded tothe Named Insured. LO 2019-483 2 of 2 COMPANY INFORMATION Your policies are underwritten by the following companies: e Policy number BD2 D418802-04 —The.Hanover. Insurance Company » Policy. number LH2 D418855-04 ~The: Hanover Insurance Company SCHEDULE OF FEES » If paymentis not received by the due.date, a fate. fee of up to $30.00 will apply, depending en your state. Additionally, each policy on your account may. generate a notice-of intent to.cancel fornion-payment, Depending on your state, a return payment fee of up.to $30.00 will be - charged for any payment not accepted by your firiancial institution. * if your policy is cancelled for non- payment of premium, depending on your state, a reinstatement fee of up to $20.00 may be charged to reinstate your policy should an.offer of reinstatement be extended, Any premium and accrued charges due-are payable and. aré not waived by the reinstatement.",insurance
84.0,"5 8 5 S S Le AMERICAN FAMILY INSURANCE § AMERICAN FAMILY INSURANCE GROUP 100 W 3RDA ELLENSBURG, WA 98926 September 27, 2021 000107EC164CAA1012672111 065357 0G1 VISTANTE HOMEOWNERS ASSOCIATIO C/O PROPVIVO 2018 156TH AVE NE BELLEVUE WA 98007-3825 REGARDING YOUR BUSINESS KEY POLICY OFFER OF TERRORISM INSURANCE COVERAGE AND DISCLOSURE OF PREMIUM Policy number Policy effective date Policy expiration date 46-X38591-01-0021 12/22/2021 12/22/2022 Thank you for insuring with American Family Insurance. The notice provides you with important information about the Terrorism Risk Insurance Program Reauthorization Act of 2015. Please read the information below about the act and notify American Family if you wish to change your previous decision regarding acceptance or rejection of the coverage for ""certified acts of terrorism."" Some Background On Nov. 26, 2002, President Bush signed the Terrorism Risk Insurance Act into law, which requires - insurance carriers to make coverage available to policyholders for losses due to “certified acts of terrorism."" This law has been reauthorized since then, and the latest reauthorization occurred in January of 2015 when President Obama signed the Terrorism Risk Insurance Program Reauthorization Act of 2015 into law. The most recent reauthorization extends the current program for six years. As an American Family customer, you have the right, under the recently reauthorized law, to purchase insurance coverage for losses resulting from “certified acts of terrorism,” which are defined as: any act that is certified by the Secretary of the Treasury, in consultation with the Secretary of Homeland Security and the Attorney General of the United States, to be an act of terrorism. The criteria contained in that law for certifying an act of terrorism includes the following: e The act is a violent act or an act that is dangerous to human life, property or infrastructure; ¢ The act results in aggregate property and casualty insurance losses in excess of $5 million; and ¢ The act is committed by an individual or individuals as part of an effort to coerce the civilian population of the United States or to influence the policy or affect the conduct of the United States Government by coercion. Further Explanation Where coverage is provided under the act for losses resulting from ""certified acts of terrorism,"" such losses may be partially reimbursed by the United States Government as established by the act. You should also understand that your policy may contain exclusions (not part of the act) that might affect your coverage. For example, if a ""certified act of terrorism"" occurs and results in damage that you're not covered for under other portions of your policy, the terrorism coverage may not apply to the loss because you need to have underlying coverage to qualify for a ""certified act of terrorism"" loss covered by the act. You should also be aware that the reauthorized act contains a $100 billion cap that limits United States Government reimbursement as well as insurers’ liability for losses resulting from “certified acts of terrorism"" to $100 billion per calendar year. What this means is, if the combined insured losses for all insurers exceeds $100 billion, your coverage may be reduced due to the cap. PLO-28831 Ed. 1/15 Page 1 of 2",insurance
85.0,"Mara Gilda , R: Chittdo ok Restitiiy Be G & @ is ave Me oeae Lee aE weiss SF eT. Nw. Les fos 05 . a wees ° - - : . er - PE ge . re ';, “OTT ° cee . . . ‘ - A Chad oa . “ . * e ute ett “ - : ular sazsoonesee “Hartand Croats wrong goLae de MESSENGERS OF THE eam",checks
86.0,"e—— eo eee eee Xie ae ** REAL ESTATE CLOSING **** Buyer/Borrower: Seller: Lender: Property: Settlement Date: Disbursement Date: Check Amount: Pay To: For: Wells Fargo Bank, N.A. ISAOA 17012 165th Ave SE, /Renton November 19, 2021 November 22, 2021 $650.00 Woodside Homeowners Association 951325820 Dan Mei Liang and Gang Wang, wife and husband Wayne Homer Slade, Jr. and Audrey A. Slade, a married couple Closer/Responsible Party: Amelia Berlanga Printed By: Allison Buchholz Order Number: 611302126 HOA - 2022 Annual Dues; HOA - Balance due thru 12/31 HOA - 2022 Annual Dues (H.05) $600.00; HOA - Balance due thru 12/31 (H.06) $50.00 FT Pierce-TAC-01 10655 NE 4th St., Suite 200 Bellevue, WA 98004-5035 Escrow No. 611302126 (425)453-8070 aed --Six Hundred Fifty and 00/100 ---------------------------------------------------=-- PAY Woodside Homeowners Association TO THE c/o Propvivo oe 2018 156th Ave NE Bellevue, WA 98007 MEMO HOA - 2022 Annual Dues; HOA - Balance due thru 12/31 MWO55e3256820"""" ta25000305!5 _THIS CHECK IS VOID WITHOUT A PURPLE & BLUE BORDER AND BACKGROUND PLUS A 2 FIDELITY NATIONAL TITLE COMPANY OF WASHINGTON, INC. US Bank LESS ee ee ee SS A PS SS SS Reply ar pe PR, NS > A oat % © , 2 ere ear ee ed as eeras ieee wey + HOLD AT ANGLE TO VIEV 551325820 November 22, 2021 19-10 1250 535 Westminster Mall Westminster, CA 92683 Ref#: 17012 165th Ave SE, Renton Dollars AMOUNT $ **650.00 CUSTODIAL ESCROW ACCOUNT VOID AFTER 90 DAYS, TWO SIGNATURES REQUIRED A PO hee def = wi) a Dy Envy ea vow bay hoy iy eae Ly kay kay Rapheeycaycoa Sr oa Ses ee ~ rs ~ | xe y , \ i \ . Sed oreo hay arate Kk 153595iaG76 761"" *** REAL ESTATE CLOSING **** 551325821 Buyer/Borrower: Dan Mei Liang and Gang Wang, wife and husband Seller: Wayne Homer Slade, Jr. and Audrey A. Slade, a married couple Lender: Wells Fargo Bank, N.A. ISAOA Property: 17012 165th Ave SE, /Renton Settlement Date: November 19, 2021 Disbursement Date: November 22, 2021 Check Amount: $150.00 Pay To: PropVivo, Inc. For: HOA - Transfer Fee HOA - Transfer Fee (H.07) $150.00 FT Pierce-TAC-01 10655 NE 4th St., Suite 200 ye Bellevue, WA 98004-5035 Escrow No. 611302126 (425)453-8070 PropVivo, Inc. 2018 156th Ave NE Bellevue, WA 98007 MEMO HOA- Transfer Fee A eee WOS5Saa25hc bu tb2500030515 Closer/Responsible Party: Amelia Berlanga Printed By: Allison Buchholz Order Number: 611302126 THIS CHECK IS VOID WITHOUT A PURPLE & BLUE BORDER AND BACKGROUND PLUS A 2SECURE WATERMARK ON THE BACKT HOLD AT ANGLE T FIDELITY NATIONAL TITLE COMPANY OF WASHINGTON, INC. US Bank 535 Westminster Mall 951 325821 Westminster, CA 92683 November 22, 2021 -10 Ref#: 17012 165th Ave SE, Renton —_ WA anne nnnnneneennnnnnnnnnnenennnnnnnnnennnennnneeinennennerernneneeenes Dollars AMOUNT $ **150.00 CUSTODIAL ESCROW ACCOUNT fe) — ft WELZ di — menus Ff Trt OT ik PELEZ bS359S5)G7B 7h AA Oa AIAN SAAS SE ea een @ Fidelity National Title HOA REQUEST ee ms COME nF sanity, Be To: PropVivo, inc. Date: November 4, 2021 2018 756th Ave NE Escrow No.: 61 1302126-AB Bellevue, WA 98007 Owner: Wayne Homer Slade, Jr. and Audrey Slade Property: 17012 165th Ave SE Renion, WA 98058 Estimated Settlement Date: November 30, 2021 Please provide. the requested information, sign the form, and return it as soon-as possible by. fax or email to the number/email provided below. Thank you for your prompt attention to this request. “4 “Amount of Maintenance Fee-""$: 606:00--: sesso ceaateeumne ge tangent | ee Ste tuna vu teas yt 2. Fees aredue: [ Monthly © Quarterly O Semi-Annually WY Annually E] Other: 3, Our billing year runs-from: January to: December 4. Fees/duées/assessments are presently: F paid through: [1 unpaid. The amount owing is: $..$50 for December dues. This will pay the dues current through: 12/31/2024 5. Amount of Transfer. $_150.00 | Mark the party to pay this transfer fee as provided for in the-association documents: LJ Seller C] Buyer N/A Maintenance Reserve Fee required by new Buyer: $ 7. Name, ‘address and phone number'of Issuing Agent that handles Master Insurance Policy: | Attached. is the COI, please refer 8. Any-special and/or-future assessments that has been.or will be levied by the Homeowners Association: No Purpose: Amount Due: $ a Date Due: . 9. Water, Sewer, Garbage’. | 10. Does. the Association have the First’ Right of Refusal to purchase the property? O Yes iv No If yes, does the Association wish to exercise. this: right?: 0 Yes CL] No 11. Are there any additional associations or road maintenance. that we need to contact? OO Yes. ‘Vf No: HOA Request- WA Printed: 11.04.24. @:09:04 AM by.ASG. WA0G00026.dee / Updated: .05.10.18 ‘Page 2 WA-FT-FTMA=-01530.611001-611302126",checks
