Unnamed: 0,Text_Data,Category
114.0,"po box64084 phoenix, al.85082 866.800.465.6 (tollfree)  primary accounlnumber ending in 2356 .statement .date nov 30, 2021 page 1 of3  ]i 111mlluhllp ,i 1h11pn1ii 11111111111111111m 11 l111dll111  :>000254 6152727 0001 8429 'oz  propvivq inc agent for  pasadera heights hoa  2018156th ave ne ste 100  bellevue wa 98007-3825  ******2356 -cab interest checking  beginning balance  .$33,018.94  average daily ba!aht:e  $32,119i32  totłl deposits  $1 ;8z1 .00  year-to-date interest paid  $21.36  total withdrawals inter.est paid ending balance  transaction  deposits/credits  detail  $3,558.15  ••  $1.32 $31;283.11  days in statement perice! annual percentageyield earned.  30  0.0!>°/o  date  descriptiori  amount  11/01  lockboxdeposit  $35.00  11/02  lockboxdeposit  $105.b0  11/03.  lockbox deposit  $110.00  11/04  lockbox deposit  $35.00  11/05  lockboxdeposit  $360.00  11/08.  lockbox deposit  $70.00  11/10  lockbox deposit  $70.00  .  11112 lockbox deposit  $70.00  11/15.  lockboxdeposit  $245.00  11/16  lockbox deposit  $10.00  11/17  lockbox deposit  $35.00  11/18  lockboxdeposit  $256.00  11/23  lockbox deposit  $80.00  11/29  lockbox deposit  $.305.00  11/29  image deposit  $35;00  11/30  interest pymt  $l32  withdrawals/debits  date  description  amount  11/02  pasadera heights pvc  204854719  psd  $1,521.00  membarfdic  citcom  li!equal housing lender  for a change of name or address, please complete the form below:  primary account number ending in statement date  name  2356 nov 30, 2021 page 2of 3  address  city _____________________ state _________  zip___________  social security no.________________________  clip and return to bank  date ____  how to balance your account  1.  subtract from your check register any service, miscellaneous or automatic charge(s) posted on this statement.  2.  mark (x) your register after each check listed on front of this statement.  3.  check off deposits shown on the statement against those shown in your check register.  4.  complete the form at right.  5.  the final ""balance"" in the form to the right should agree with your check register balance. if it does not, read ""hints for finding differences"" below.  hints for finding differences  •  recheck all additions and subtractions or corrections.  •  verify the carryover balance from page to page in your check register.  •  make sure you have subtracted the service or miscellaneous charge(s) from your check register balance.  in case of error or questions about your electronic transfers call or write us as soon as you can if you think your statement or receipt is wrong or if you need more information about a transfer on the statement or receipt. we must hear from you no later than sixty (60) days after we sent you the first statement on which the error or problem appeared.  (1)  tell us your name and account number.  (2)  describe the error or the transfer you are unsure about, and explain as clearly as  you can why you believe there is an error or why you need information. (3) tell us the dollar amount of the suspected error.  we will investigate your complaint and will correct any error promptly. if we take more than ten (10) business days to do this, we will recredit your account the amount you think is in error, so that you will have use of the money during the time it takes us to complete our investigation.  what to do if you think you find a mistake on your statement  if you think there is an error on your line of credit statement, write to us at the  address listed below. in your letter, give us the following infonnatlon:  1.  your name and account number,  2.  the dollar amount of the suspected error,  3.  if you think there is an error on your bill, describe what you believe is wrong and -why _you believe it.is,..a mistake.  you must contact us within 60 days after the error appeared on your statement. you must notify us of any potential errors in writing. you may call us, but if you do we are not required to investigate any potential errors and you may have to pay the amount in question.  while we investigate whether or not there has been an error, the following are true: -we cannot try to collect the amount in question, or report you as delinquent on that amount;  -the charge in question may mmaln on your statement, and we may continue to charge you interest on that amount. but, if we determine that we made a mistake, you will not  have to pay the amount in question or any interest or other fees related to that amount; -while you do not have to pay the amount in question, you are responsible for the remainder of your balance;  -we can apply any unpaid amount against your credit limit.  average daily balance (including new purchases)  this balance is figured by adding the outstanding balance (including new purchases and deducting payments and credits) for each day in the billing cycle, and then dividing by the number of days ln the billing cycle.  in case of error or questions, call us  at 402.351.8000 • 8 66.351.5646  or write to us at  cit bank, n.a.  4950 s 48th street  phoenix, az 85040  new balance  transfer amount from other side  $ 31,283 11  ado:  deposits made  since ending date  on statement  subtotal  $  checks not listed on this  or prior statements  number  amount  total checks  ...  not listed  subtract total checks  not listed from  subtotal above balance  this should agree with your check  register balance.  $  primary acc:ourit nurriber ending in 2356 statem1mt date nov 30, .2021 page3of3  withdrawals/debits  date  description  -sett-a228sftp5  amount  11/04  pudn01-snohomish utility  pasadera heigi-ffs hoa p  .8881763  $18.38  11/23  pasadera heights pvc psd  204854719  --sett-a228sftp5  $9ab.77  11/26  web tfrto000262831531  monthly reserve transfer  090319007823  $1,080.00 ",Bank Statement
115.0,"po box64084 phoenix, az 85082 866.800.4656 (toll free)  primary account number ending in statement date nov 30, 2021  6980  page 1 of 4  hn i• 11 i' 111111111111 i' lll1p111l1jll j• 1ll11lnll 1'11•1 h ii 11 ill  >000382 6152727 0001 8429 1 oz  propvivo inc agent for  woodside homeowners association  operating account  2018 156th ave ne ste 100  bellevue wa 98007-3825  łłł ł łłłł łłł łł łłłł łłłłłłłł  beginning balance  $47,959.63  average daily balance  $37,340.00  total deposits  $4, 797.58  year-to-date interest paid  $21.48  total withdrawals  $22,069.74  days in statement period  30  interest paid  $1.53  annual percentage yield earned  0.05%  ending balance  $30,689.00  transaction detail  deposits/credits  date  description  amount  11/01  image deposit  $99.50  11/03  lockbox deposit  $193.36  11/04  lockbox deposit  $50.00  11/05  image deposit  $636.00  11/05  lockbox deposit  $146.00  11/05  image deposit  $100.00  11/12  lockbox deposit  $48.00  11/15  lockbox deposit  $25.00  11/18  woodside wds dues  912090202  $50.00  -sett-a228sftp5  11/19  lockbox deposit  $661.00  11/22  lockbox deposit  $48.00  11/23  lockbox deposit  $320.00  11/29  image deposit  $1, 570.72  11/29  image deposit  $600.00  11/29  image deposit  $150.00  11/29  image deposit  $100.00  11/30  interest pymt  $1.53  member fdic  cit.com  !ltequal housing lender  name  address city _____________________ state _________  zip ___________  social security no.  clip and return to bank  date ____ /  _  how to balance your account  1.  subtract from your check register any service, miscellaneous or automatic charge(s) posted on this statement.  2.  mark (x) your register after each check listed on front of this statement.  3.  check off deposits shown on the statement against those shown in your check register.  4.  complete the form at right.  5.  the final ""balance"" in the form to the right should agree with your check register balance. if it does not, read ""hints for finding differences"" below.  hints for finding differences  •  recheck all additions and subtractions or corrections.  verify the carryover balance from page to page in your check register.  •  make sure you have subtracted the service or miscellaneous charge(s) from your check register balance.  in case of error or questions about your electronic transfers call or write us as soon as you can if you think your statement or receipt is wrong or if you need more information about a transfer on the statement or receipt. we must hear from you no later than sixty (60) days after we sent you the first statement on which the error or problem appeared,  (1)  tell us your name and account number.  (2)  describe the error or the transfer you are unsure about, and explain as clearly as you can why you believe there is an error or why you need information.  (3)  tell us the dollar amount of the suspected error.  we will investigate your complaint and will conect any error promptly. if we take more than ten (10) business days to do this, we will recredit your account the amount you think is in error, so that you will have use of the money during the time it takes us to complete our investigation.  what to do if you think you find a mistake on your statement  if you think there is an error on your line of credit statement, write to us at the  address listed below. in your letter, give us the following infonnalion:  1.  your name and account number,  2.  the dollar amount of the suspected error,  3.  if you think there is an error on your bill, describe what you believe is wrong and why you belleve-11--is a--mllltake.  you must contact us within 60 days after the error appeared on your statement. you must notify us of any potential errors in writing. you may call us, but if you do we are not required to investigate any potential errors and you may have to pay the amount in question.  while we investigate whether or not there has been an error, the following are true: -we cannot try to collect the amount in question, or report you as delinquent on that amount;  -the charge in question may remain on your statement, and we may continue to charge you interest on that amount. but, h we determine that we made a mistake, you will not  have to pay the amount in question or any interest or other fees related to that amount; -while you do not have to pay the amount in question, you are responsible for the remainder of your balance;  -we can apply any unpaid amount against your credit limit.  average daily balance (including new purchases)  this balance is figured by adding the outstanding balance (including new purchases and deducting payments and credits} for each day in the billing cycle, and then dividing by the number of days in the billing cycle.  in case of error or questions, call us  at 402.351.8000 • 866.351.5646  or write to us at  cit bank, n.a.  4950 s 48th street  phoenix, az 85040  new balance  transfer amount from other side  s 30,689 00  add:  deposits made  since ending date  on statement  subtotal  $  checks not listed on this  or prior statements  number  amount  total checks  ...  not listed  subtract total checks  not listed from  subtotal above balance  this should agree with your check  łgister balance.  s  withdrawals/debits  date  description  amount  11/02  woodside pvcwds  912090202  -sett-a228sftp5  $3,760.00  11/04  microsoft 6041  edi paymnt  trn*1*z41 cwirfcm8g\  $4.00  11/04  microsoft 6041  edi paymnt  $5.51  trn*1*z41awj8c1ezf\  ł 11/04  microsoft 6041  edi paymnt  trn*1*z41cwiqvckrg\  $12.34  11/15  -king county sher bill pay  5559 propvivo inc  tran#1468  -$211.00  11/15  capital lighting bill pay  5559 propvivo inc  tran#1466  $370.44  11/15  mark pike bill pay  5559 propvivo inc  tran#1467  $1,535.60  11/15  osaka garden inc bill pay  5559 propvivo inc  tran#1470  $10,045.66  11/16  woodside pvcwds  912090202  -sett-a228sftp5  $2,968.96  11/22  puget sound ener billpay  woodside homeowner ass  puget sound ene  $10.22  11/22  puget sound ener billpay  woodside homeowner ass  puget sound ene  $10.22  11/22  puget sound ener billpay  woodside homeowner ass  puget sound ene  $10.22  11/22  puget sound ener billpay  woodside homeowner ass  puget sound ene  $10.22  11/22  puget sound ener billpay  woodside homeowner ass  puget sound ene  $10.44  11/22  puget sound ener billpay  woodside homeowner ass  puget sound ene  $10.56  11/22  puget sound ener billpay  woodside homeowner ass  $10.66  withdrawals/debits  date  description  puget sound ene  amount  11/22  puget sound ener billpay  woodside homeowner ass  puget sound ene  $10.66  11/22  puget sound ener billpay  woodside homeowner ass  puget sound ene  $11.10  11/22  puget sound ener billpay  woodside homeowner ass  puget sound ene  $14.20  11/22  puget sound ener billpay  woodside homeowner ass  puget sound ene  $47.73  11/26  web tfr to 000262836568  monthly reserve transfer  090342007831  $3,000.00 ",Bank Statement
116.0,"po box 64084 phoenix, az 85082 866.800.4656 (toll free)  primary account number ending in 2399 statement date nov 30, 2021 page 1 of 3  111111111111111l11111ll11l 1111111111 ii 11 l11l 11 l1 l1 ii 1l 11 ii l11l l11  >000379 6152727 0001 8429 1 oz  propvivo inc agent for  forest isle condos owners assoc  2018 156th ave ne ste 100  bellevue wa 98007-3825  1******2399 -cab interest checking  beginning balance total deposits total withdrawals  interest paid  ending balance  $0.96  $19,070.06  $23,958.86 $4,500.00 $9,389.76  average daily balance year-to-date interest paid  days in statement period annual percentage yield earned  $23,597.10  $14.23  30  0.05%  transaction detail  deposits/credits  date  11/01  11/02  11/04  11/05  11/10  description  lockbox deposit  lockbox deposit  lockbox deposit  lockbox deposit  lockbox deposit  amount  $500.00  $500.00  $500.00  $500.00  $500.00  11/12  11/19  lockbox deposit  lockbox deposit  $500.00  $500.00  11/24 lockbox deposit 11/30 lockbox deposit 11/30 interest pymt  withdrawals/debits  $500.00  $500.00  $0.96  date  11/02  description  forest isle pvc fri  911693637  -sett-a228sftp5  amount  $920.00  11/09  alderwood water billpay  forest isle  alderwood water  $15.50  11/09  alderwood water billpay  forest isle  $15.50  member fdic  cit.com  l!tequal housing lender  for a change of name or address, please complete the form below:  primary account number ending in statement date  name  2399 nov 30, 2021 page 2 of 3  address_______ city _____________________ state _________  zip ___________  social security no. clip and return to bank  date ____  how to balance your account  1.  subtract from your check register any service, miscellaneous or automatic charge(s) posted on this statement.  2.  mark (x) your register after each check listed on front of this statement.  3.  check off deposits shown on the statement against those shown in your check register.  4.  complete the form at right.  5.  the final ""balance"" in the form to the right should agree with your check register balance. if it does not, read ""hints for finding differences"" below.  hints for finding differences  •  recheck all additions and subtractions or corrections.  •  verify the carryover balance from page to page in your check register.  •  make sure you have subtracted the service or miscellaneous charge(s) from your check register balance.  in case of error or questions about your electronic transfers call or write us as soon as you can if you think your statement or receipt is wrong or if you need more information about a transfer on the statement or receipt. we must hear from you no later than sixty (60) days after we sent you the first statement on which the error or problem appeared.  (1)  tell us your name and account number.  (2)  describe the error or the transfer you are unsure about, and explain as clearly as you can why you believe there is an error or why you need information.  (3)  tell us the dollar amount of the suspected error.  we will investigate your complaint and will correct any error promptly. ii we take more than ten (10) business days to do this, we will recredit your account the amount you think is in error, so that you will have use of the money during the time it takes us to complete our investigation.  what to do if you think you find a mistake on your statement  if you think there is an error on your line of credit statement, write to us at the address listed below. in your letter, give us the following infonnation;  1.  your name and account number,  2.  the dollar amount of the suspected error,  3.  if you think there is an error on your bill, describe what you believe is wrong and  why y.pilbe.liq\dł.il..mlstake.  you must contact us within 60 days after the error appeared on your statement. you must notify us of any potential errors in writing. you may call us, but ii you do we are not required to investigate any potential errors and you may have to pay the amount in question.  while we investigate whether or not there has been an error, the following are true: -we cannot try to collect the amount in question, or report you as delinquent on that amount;  -the charge in question may remain on your statement, and we may continue to charge you interest on that amounl but, if we determine that we made a mistake, you will not  have to pay the amount in question or any interest or other fees related to that amount; -while you do not have to pay the amount in question, you are responsible for the remainder of your balance;  -we can apply any unpaid amount against your credit limit.  average daily balance (including new purchases)  this balance is figured by adding the outstanding balance (including new purchases and deducting payments and credits) for each day in the billing cycle, and then dividing by the number of days in the billing cycle.  in case of error or questions, call us  at 402.351.8000 • 866.351.5646  or write to us at  cit bank, n.a.  4950 s 48th street  phoenix, az 85040  new balance  transfer amount from other side  $ 19,070 06  add:  deposits made  since ending date  on statement  subtotal  s  checks not listed on this  or prior statements  number  amount  total checks  ...  not listed  subtract total checks  not listed from  subtotal above balance  this should agree with your check  register balance.  $  primary account number ending in 2399 statement date nov 30, 2021 page 3 of3  withdrawals/debits  dałe  de:scription  alderwood water  amount  11/09  a lde'.rwood water billpay  forest isle  alderwood water  $136.78  11/12  orkin .bill pay  5559 propvivo inc  tran#1452  $257.23  11/12  transblue bill pay  $1,065:40  ł  5559 propvjvo inc  tran#1451  . . ..  11/22  q pudn01-snhomish utility  forest isle condo hoa  ..-.,._ -·  8586348  $34.30  11/22  pudn01-snohomish utility  forest isle condo hoa  8586347  $37.39  11/23  y\faste management internet  isle forest  0430/i;t!!.'n!#ii!yf!#if  $497,66  11/26  web tfr to 000262831574  monthly reserve transfer  090251007813  $6,410,00  002797 1:i10.259  oo.ooodo 00392.b  aonso 02/0;i ",Bank Statement
117.0,"p0box64084 phoenix, az 85082 866.800:4656 (toll free)  primary account number ending in 2348 slalemerit date ---nov 30, 2021 page 1 of3  1111•11dlhll11•111h111111ilh111•1111111111hllnpllhhh111  >000330 6152727 00018429 1 oz  propvivo inc agent for  92nd street condominium owners assoc  2018 156th ave ne ste 100  bellevue wa 98007-3825  ******2348 -cab interest checking  beginning balance  $4,789.66  average dally balance  $4,093.05  total deposits  $10,799.36  yeat-to-,date interest paid  $3.73  total withdrawals  $4,675,77  days in statement period  30  interest pald  $0.17  annlla! percentage yield earned  0.05%  ending balance  $10,913.42  transaction detail  d eposits/cr,edits  date  descripuon  amount  11/01  pin retthe home 00845103021 11616aurora ave no seattle wa 130443000154  $3.84  :11105  lockbox deposit  $795.52  11/30  nss _ transfer  92nd street  $10,000.00  11/30  interest pymt  $0.17  withdrawals/de-bits  date  des_cri ption  amount  11/01  scott soros bill pay  5559 propvivo inc  tran#t411  $132.00  11/02  92nd st condo pvcnss  352323681  -sett-a228sftp5  $275.00  11/09  rec pur pay* handy 0845110821 pay* handy.com-novo new york ny 497649  $120.00  11/15  pin purpaypal*al 0845111221 2211 north first st  $275;50  membaffdic  citc:om  d:requal housing lei'id&r  for a change of name or address, please complete the form below:  primary account number ending in statement date  name  2348 nov 30, 2021 page 2 of 3  address city ______________________ state __________ zip  social security no. clip and return to bank  date  _  how to balance your account  1.  subtract from your check register any service, miscellaneous or automatic charge(s) posted on this statement.  2.  mark (x) your register after each check listed on front of this statement.  3.  check off deposits shown on the statement against those shown in your check register.  4.  complete the form at right.  5.  the final ""balance"" in the form to the right should agree with your check register balance. if it does not, read ""hints for finding differences"" below.  hints for finding differences  •  recheck all additions and subtractions or corrections.  •  verify the carryover balance from page to page in your check register.  make sure you have subtracted the service or miscellaneous charge(s) from your check register balance.  in case of error or questions about your electronic transfers call or write us as soon as you can if you think your statement or receipt is wrong or if you need more information about a transfer on the statement or receipt. we must hear from you no later than sixty (60)days after we sent you the first statement on which the error or problem appeared.  (1)  tell us your name and account number.  (2)  describe the error or the transfer you are unsure about, and explain as clearly as you can why you believe there ls an error or why you need information.  (3)  tell us the dollar amount of the suspected error.  we will investigate your complaint and will correct any error promptly. if we take more than ten (10) business days to do this, we will recredlt your account the amount you think is in error, so that you wili have use of the money during the time it takes us to complete our investigation.  what to do if you think you find a mistake on your statement  if you think there is an error on your line of credit statement, write to us at the  address listed below. in your letter, give us the following infonnation:  1.  your name and account numt>er,  2.  the dollar amount of the suspected error,  3.  if you think there is an error on your bill, describe what you believe is wrong and why you believe it is amiitake.  you must contact us within 60 days after the error appeared on your statement. you must notify us of any potential errors in writing. you may call us, but if you do we are not required to investigate any potential errors and you may have to pay the amount in question.  while we investigate whether or not there has been an error, the following are true: -we cannot try to collect the amount in question, or report you as delinquent on that amount;  -the charge in question may remain on your statement, and we may continue to charge you interest on that amount. but, if we determine that we made a mistake, you w!ii not  have to pay the amount in question or any interest or other fees related to that amount; -while you do not have to pay the amount in question, you are responsible for the  remainder of your balance;  -we can apply any unpaid amount against your credtt limit.  average daily balance (including new purchases)  this balance is figured by adding the outstanding balance (including new purchases and deducting payments and credits) for each day in the billing cycle, and then dividing by the number of days in the billing cyc!e.  in case of error or questions, call us  at 402.351.8000 • 866.351.5646  or write to us at  cit bank, n.a.  4950 s 48th street  phoenix, az 85040  new balance  transfer amount from other sioe  $ 10,913 42  add:  deposits made  since ending date on statement  subtotal  $  checks not listed on this  or prior statements  number  amount  total checks  ł- not listed  subtract total checks  not listed from  subtotal above balance  this should agree with your check  register balance.  $  primary.accourit number ending l_r'i 2348 statement date no113o; 2021 page3 of 3.  withorawals/debits  date  description  san jose_ ca 131632464058  amount  11/15  hanover ins billpay  -92nd street condotlainju  in$ pmnt  $404.50  11/23  rec pur pay* handy 0845 112221 pay* handy,com-:nov2 new york ny 825771  $120.00  . .  1_1/23  sl=attleutilties web_pay  92nd street condo  2b98n!inl!#n!{ifnif.  $2,275.44  11/26  web tfr to 000262831523  monthly reserve transfer  ·~· ••••••  - ••  ""090315007822  $1,073.33  002746 1370259. 0000000  003830 007660 02/02 ",Bank Statement
